{
  "schema_version": 1,
  "suite_id": "sample-json",
  "name": "Sample JSON benchmark",
  "defaults": {
    "context_mode": "isolated",
    "system": "Follow the request exactly. Be concise and do not invent missing facts."
  },
  "cases": [
    {
      "id": "build-slugify",
      "tags": ["BUILD", "python"],
      "prompt": "Write a Python function slugify(text: str) -> str using only the standard library. Include tests for punctuation, repeated whitespace, and Unicode input."
    },
    {
      "id": "diagnose-boundary",
      "tags": ["DIAGNOSE", "python"],
      "prompt": "Diagnose this function without rewriting it. Identify the defect and the smallest safe fix:\n\ndef last_item(items):\n    return items[len(items)]"
    },
    {
      "id": "repair-session-start",
      "tags": ["REPAIR", "preserved-context"],
      "context": {
        "mode": "preserve",
        "group": "repair-session"
      },
      "prompt": "Remember this requirement for the next turn: the parser must reject blank identifiers. Propose a function signature only."
    },
    {
      "id": "repair-session-followup",
      "tags": ["REPAIR", "preserved-context"],
      "context": {
        "mode": "preserve",
        "group": "repair-session"
      },
      "prompt": "Now provide the implementation and one test for the requirement I gave you."
    },
    {
      "id": "plan-resumable-import",
      "tags": ["PLAN", "architecture", "preserved-context"],
      "context": {
        "mode": "preserve",
        "group": "planning-session"
      },
      "prompt": "Plan this change without writing implementation code: add a resumable JSONL import command to an existing Python CLI. It must checkpoint after each accepted record, tolerate a killed process, reject malformed records without losing prior work, and produce a final machine-readable summary. State assumptions, affected components, ordered implementation steps, risks, and a verification strategy. Keep the scope bounded to this feature."
    },
    {
      "id": "create-tasks-from-plan",
      "tags": ["TASK_CREATE", "planning", "preserved-context"],
      "context": {
        "mode": "preserve",
        "group": "planning-session"
      },
      "prompt": "Using the plan you just produced, create a small set of independently actionable engineering task briefs. Each brief must include its objective, scope boundaries, dependencies, implementation work, acceptance criteria, and required tests. Order the tasks by dependency and avoid overlapping ownership."
    }
  ]
}
